{
  "apiVersion": "aep.dev/v1alpha1",
  "kind": "Tool",
  "metadata": {
    "name": "github-read-issue",
    "version": "1.0.0"
  },
  "spec": {
    "category": "external-service",
    "capabilities": ["github.issue.read"],
    "inputSchema": {
      "type": "object"
    },
    "outputSchema": {
      "type": "object"
    },
    "permissions": ["github:read"],
    "timeoutMs": 30000
  }
}
